{
  "schema_version": "2.0.0",
  "workflow_run_id": "018f1e2d-3c4b-7a15-8c9d-001122334465",
  "command_id": "018f1e2d-3c4b-7a10-8c9d-001122334460",
  "tenant_id": "018f1e2d-3c4b-7a01-8c9d-001122334455",
  "session_id": "018f1e2d-3c4b-7a02-8c9d-001122334456",
  "source_event_id": "018f1e2d-3c4b-7a11-8c9d-001122334461",
  "source_event_fingerprint": "aaaaaaaaaaaaaaaaaaaaaaaaaaaaaaaaaaaaaaaaaaaaaaaaaaaaaaaaaaaaaaaa",
  "source_aggregate_version": 5,
  "source_state_hash": "bbbbbbbbbbbbbbbbbbbbbbbbbbbbbbbbbbbbbbbbbbbbbbbbbbbbbbbbbbbbbbbb",
  "trace_id": "11111111111111112222222222222222",
  "correlation_id": "018f1e2d-3c4b-7a12-8c9d-001122334462",
  "causation_id": "018f1e2d-3c4b-7a13-8c9d-001122334463",
  "status": "waiting",
  "current_step": "evaluate",
  "state_version": 3,
  "attempts": 2,
  "max_attempts": 4,
  "next_attempt_at": "2026-07-15T12:00:05Z",
  "last_error_code": "activity_retryable",
  "result_hash": null,
  "started_at": "2026-07-15T12:00:00Z",
  "updated_at": "2026-07-15T12:00:01Z",
  "completed_at": null,
  "cancelled_at": null,
  "data_classification": "internal"
}
